conversation_id,turn_no,speaker,utterance,strategy
3087,7,0,What will be the price of the bundle if I buy all the above 3 items?,3
3087,7,1,The bundle would only cost you $21900.0 it is a killer deal for the product.,3
3087,8,0,What will be the price of the bundle if I buy the camera along with the lens filters?,3
3087,8,1,The bundle including the camera along with the lens filters will be $22600.0 How does that sound?,7
3087,9,0,The bundle including the camera along with the lens filters will be $19700.0 I cannot go above that.,7
3103,1,0,"What would be the price for the TV, TV stand, and extension cord?",2
3103,1,1,"As for the TV, TV stand, and extension cord, they would cost you $75200.0 it is a killer deal for the product.",2
3103,2,0,"I'm sorry, but I can't afford that. Can you sell them for the price of $55800.0",5
3103,2,1,"I understand your budget constraints, but I'm sorry I cannot reduce the price of the TV. It has a 60 Hz refresh rate, 65-inch screen, Dolby Vision and Atmos for enhanced audio and visual experiences, and a A Extension Cord called Tripp Lite Heavy Duty Power Extension Cord. It is suitable for indoor use and has a 3-prong grounded plug and 3-prong outlets, making it easy to use. I'm sure that it will be worth the investment even for $75200.0",1
3103,3,0,I can only go up to $55800.0 I cannot go further than that.,5
3103,3,1,"While I understand your budget constraints, I'm sorry I cannot reduce the price of the Skyworth Q71 Series TV. It has a 65-inch screen, Dolby Vision, Atmos, and a 60Hz refresh rate, making it one of the best TVs on the market. It is also one of the newest models from Skyworth, which adds to its value. I'm sure that it will be worth the investment even for $75200.0",1
3103,4,0,I cannot afford $75200.0 I can only go up to $55800.0,5
3103,4,1,"I understand your budget constraints, but I'm sorry I cannot reduce the price of the TV since it has great features such as a 65-inch screen, Dolby Vision and Atmos, and a 3-prong grounded plug and 3-prong outlets. It also has a 10-foot extension cord that is suitable for indoor use and is designed to resist wear and tear. I'm sure that it will be worth the investment even for $75200.0",1
3103,5,0,$55800.0 is the maximum that I can afford for this product.,1
3103,5,1,"I understand that you can only afford $55800.0 for this product. However, I'm willing to meet you in the middle at $60200.0 Are you interested?",4
3103,6,0,"I do not need the delivery of the TV, can you sell me the TV without the delivery? What would be the price?",2
3103,6,1,"You will have to pay for the delivery of the TV, so it is not possible to sell you it without the delivery, sorry about that.",7
3103,7,0,"No problem, I can wait for the TV to arrive.",7
3103,7,1,"No problem, I can wait for the TV to arrive.",7
3106,1,0,I really like the refrigerator but I cannot afford a $58300.0 refrigerator. Can you sell me the refrigerator for $40000.0 without the ice maker and door cover?,5
3106,1,1,"Oh I see, I can remove the ice maker and door cover from the refrigerator and sell you the refrigerator for $20,000, however $40000.0 is too less, how about $54600.0",4
3106,2,0,I cannot accept the offer of $40000.0 I'll look for other options. Good bye,7
3117,1,0,"Hello there, I'm interested in buying your MFC-L2750DW XL printer. How much can I get it for?",7
3117,1,1,Hello! I'm selling my Brother MFC-L2750DW XL printer for $48200.0,7
3117,2,0,"What would be the price for the printer, adapter, and the paper?",7
3117,2,1,"It's a fantastic deal for the product, it is the best deal in the market.",7
3117,3,0,I really want to buy this printer but I do not need the wireless adapter. I can buy it for $38400.0,7
3117,3,1,"Sure, I can sell you the printer but it'll cost you $48400. I'm sorry I couldn't match your offer of $38400.0 I'm confident that the printer is worth $47400.0 and I'm sure you would be happy with the printer!",4
3117,4,0,Who manufactured this printer?,7
3117,4,1,This printer is manufactured by Brother.,1
3117,5,0,"Hey, I am interested in buying the printer. I do not need the accessories, however, I would like to include the accessories in the deal. How much would this be?",2
3117,5,1,The printer along with the accessories would cost you $46900.0 it is a killer deal for the product.,7
3117,6,0,What will be your best offer if I buy this printer and wireless adapter as well?,7
3117,6,1,"The printer, the wireless adapter, and the printer driver would be $47600.0 this is a killer deal for the product.",7
3117,7,0,"I appreciate the offer, but I'm not interested in the printer. I'd like to make an offer on the wireless adapter and the printer driver.",7
3117,7,1,"I understand that the printer is not your main interest. However, the printer has a lot of features that you may be interested in. I'm willing to reduce the price to $43600.0 Are you interested?",4
3117,8,0,I'm interested. Can you lower the price to $41100.0,4
3117,8,1,"Sure, I can see that you are willing to pay a high price for the product. I am willing to negotiate the price down to $41100.0 can I proceed with the transaction?",4
3126,1,0,"What would be the price for the iPhone, tripods, and selfie stick?",7
3126,1,1,"I can sell you the iPhone, tripod, and selfie stick for $61300.0",4
3126,2,0,I can only afford $50500.0 Is there any way you can meet me in the middle?,2
3126,2,1,"I understand your budget constraints, but I'm sorry I cannot reduce the price of the iPhone 13 Pro Max. It has a 6.7-inch Super Retina XDR display, A15 Bionic chipset, 12 GB RAM, 5G connectivity, up to 1TB of storage, and a triple-camera system with Night mode. along with a A Tripods called KobraTech Mini Phone Tripod. This compact and lightweight tripod is perfect for use with smartphones and includes a wireless remote control for easy operation. It features a spring-loaded phone holder and adjustable legs for versatile shooting angles., and a A Selfie Stick called Anker Bluetooth Selfie Stick. This selfie stick has a sleek design and is compatible with most",1
3126,3,0,"I want the phone only, but I cannot afford the tripods and selfie stick. Can you just sell me the phone for $49300.0",5
3126,3,1,"Why not? I can remove the selfie stick from the bundle and sell you the phone only, but I'd have to increase the price by $60100.0 Is it not worth it?",2
3126,4,0,"Hello, I am interested in buying the iPhone 13 Pro Max but I do not need the Selfie Stick. Is it possible to buy the phone without the Selfie Stick? What would be the new price?",2
3126,4,1,"Sure, if you don't need the Selfie Stick the price would be $59100.0",2
3126,5,0,"I can only afford $59100.0 for this product, I cannot afford $48300.0",5
3126,5,1,I understand that you can only afford to pay $48300.0 for this product. I'm willing to sell it to you for $54800.0 I'm sure you will be happy with it. Are you interested?,4
3126,6,0,What is your best deal if I were to buy the Selfie Stick as well?,3
3126,6,1,"I have 2 different products for you, the Selfie Stick and the Selfie Stick 2, I would sell the bundle to you for $55700.0 how does that sound?",4
3126,7,0,"Hello, I am interested in buying the set of goods but I do not need the tripod. Is it possible to buy the set without the tripod? What would be the new price?",2
3126,7,1,"Hello, I am interested in buying the set of goods but I do not need the tripod. Is it possible to buy the set without the tripod? What would be the new price?",2
3126,8,0,"What would be the total price of the iPhone 13 Pro Max, Tripod, and Selfie Stick?",7
3126,8,1,$55200.0 that is a great deal for the products.,4
3126,9,0,"Sorry, $55200.0 is way out of my budget. Can you please meet me in the middle and sell for $49500.0",4
3126,9,1,"While I understand your budget constraints, I'm sorry I cannot reduce the price of the iPhone 13 Pro Max. It has a 6.7-inch Super Retina XDR display, A15 Bionic chipset, 12 GB RAM, 5G connectivity, up to 1TB of storage, and a triple-camera system with Night mode. along with a A Tripods called KobraTech Mini Phone Tripod. This compact and lightweight tripod is perfect for use with smartphones and includes a wireless remote control for easy operation. It features a spring-loaded phone holder and adjustable legs for versatile shooting angles., and a A Selfie Stick called Anker Bluetooth Selfie Stick. This selfie stick has a sleek design and is compatible with most",1
3126,10,0,What is the total price if I buy the iPhone 13 Pro Max with the KobraTech Mini Phone Tripod and the Anker Bluetooth Selfie Stick?,3
3126,10,1,"Well, the total package price for the iPhone 13 Pro Max w/ KobraTech Mini Phone Tripod and the Anker Bluetooth Selfie Stick would be $56300.0 how does that sound?",7
3126,11,0,Is the RAM of the iPhone 13 Pro Max 6 GB as advertised?,7
3126,11,1,"Yes, the iPhone 13 Pro Max has 6 GB of RAM as advertised. I'm also happy to help you with any other queries that you may have.",1
3126,12,0,I cannot go more than $'NA' I appreciate your offer of $50600.0 but I cannot go further.,4
3126,12,1,"I understand your budget constraints, but I'm sorry I cannot reduce the price of the iPhone 13 Pro Max. It has a 6.7-inch Super Retina XDR display, A15 Bionic chipset, 12 GB RAM, 5G connectivity, up to 1TB of storage, and a triple-camera system with Night mode. along with a Tripods called KobraTech Mini Phone Tripod. This compact and lightweight tripod is perfect for use with smartphones and includes a wireless remote control for easy operation. It features a spring-loaded phone holder and adjustable legs for versatile shooting angles., and a Selfie Stick called Anker Bluetooth Selfie Stick. This selfie stick has a sleek design and is compatible with most smartphones. It",1
3126,13,0,"I understand your offer, but I cannot accept it. I appreciate your offer, but I need to stick with my budget of $52000.0 Please let me know if you have any other deals. Thank you.",7
3126,13,1,"Okay, we have no other offers available. Shall we proceed with the payment?",7
3126,14,0,"Okay, we have no other offers available. Shall we proceed with the payment?",7
3126,14,1,Great! Let me make sure that the payment is processed.,7
3132,1,0,"Hello, I'm interested in buying the HP OfficeJet Pro 9025e All-In-One Printer. I was looking at a refurbished printer for $26400.0 It was on sale, but I would like to buy you printer instead.",7
3132,1,1,"Hello there! I'm so sorry this printer is out of stock at this time. I can't offer you a refund because it is out of stock, but I can offer you the same price of $30,900 plus $26400.0 in tax. Let me know if you would like to purchase this printer for $30900.0",4
3132,2,0,Can we remove the Ink or toner cartridges from the deal? What would be the new price?,3
3132,2,1,"Certainly, if you want to remove the ink or toner cartridges from the deal it will be $29500.0 How does that sound?",7
3132,3,0,"I cannot go more than $29500.0 for this product, I can only go up to $25000.0",5
3132,3,1,"I understand that you cannot go more than $25000.0 for this product. However, I am willing to meet you in the middle at $27700.0 Are you interested?",4
3132,4,0,"Yes, I am interested. Let's proceed with the transaction.""",7
3132,4,1,Thank you for your interest in the product. I am sure that you will be happy with your purchase. Let's proceed with the transaction.,7
3134,1,0,"Hi, I am interested in buying a laser printer Canon PIXMA TS9520 that you have listed. How much can I get it for?",7
3134,1,1,"Hello! The Canon PIXMA TS9520 printer is being sold for $42400.0 it comes with a Wireless adapters that are TP-Link Archer T9UH, a ink cartridge that is HP 902XL High Yield Ink Cartridge, a Wireless adapter that is TP-Link Archer T9UH, a Wireless adapters that are TP-Link Archer T9UH.",7
3134,2,0,"I'm interested in the Canon PIXMA TS9520 printer, but I'm not interested in the accessories. Do you think I can get a discount if I purchase the printer only?",4
3134,2,1,"I understand your budget constraints, but I'm sorry I cannot reduce the price of the printer. It has a wireless connectivity, automatic two-sided printing, and a 4.3-inch LCD touchscreen display. It has a print speed of up to 15 pages per minute in black and white and up to 10 pages per minute in color. It also features HP's proprietary ink technology for high-quality prints. I'm sure that it will be worth the investment even for $42400.0",1
3134,3,0,I do not need the ink cartridge and toner cartridge. Can we remove them from the package and how much will the new price for the printer?,7
3134,3,1,With the ink and toner removed it would only cost $41000.0 it is a killer deal for the product.,7
3134,4,0,"Hi, I bought a printer and ink cartridges but I do not need the wireless adapters. Do you have a price for the new deal?",7
3134,4,1,"Yes, you can have the printer ink cartridges and the wireless adapters for $40200.0 how does that sound?",7
3134,5,0,I appreciate the offer of $40200.0 but I cannot go more than $32900.0,4
3134,5,1,"I understand that $32900.0 is a little out of your budget, but I'm willing to meet you in the middle at $37300.0 I'm sure you will be satisfied with the quality of this product. Can we shake on this?",4
3134,6,0,Is the Canon PIXMA TS9520 all-in-one printer wireless?,7
3134,6,1,"Yes, the Canon PIXMA TS9520 printer is wireless.",1
3134,7,0,This printer looks amazing. I would love to have it in my home. And at $34200.0 it looks like an excellent deal. Let's make the deal.,7
3134,7,1,"That's great, I'm really excited about this new printer that I have for sale. It looks exactly like the one you have in your home. The only problem is that I don't have that much cash on hand. I need to sell my other printer to pay the rest of the money. Would you be willing to take that one instead?",4
3137,1,0,That's a lot for a camera. I'm not willing to pay that much. Let me know if you're interested in the A6600.,7
3137,1,1,"Hello, thank you for your interest in the A6600. While I understand that you're not willing to pay $35100.0 I'm sorry I cannot go as low as you requested. This camera has a 24.2 megapixel resolution, 425 autofocus points, 5-axis in-body image stabilization, 11fps continuous shooting, and 4K video recording. You can find a few similar cameras at a lower price, but this one is worth every penny. It's also a camera that will provide you with a lifetime of great photos and videos. Let me know if you'd like to purchase it for $45900.0",7
3137,2,0,What are Lens filters?,7
3137,2,1,A Lens filter is a thin piece of material that fits in the front of the lens of a camera. It filters the light that enters the lens and helps to reduce haze in photos. It improves the clarity of images taken outdoors and protects the lens from damaging sunlight.,1
3137,3,0,"Excuse me, I do not need the delivery. I want to pick up the items in store and pay for the shipping. How much would that be?",2
3137,3,1,The product is $34600.0 and the shipping would be $45400.0,6
3137,4,0,"I want to buy the camera, but I do not need the lens filter. What can you offer?",7
3137,4,1,Great! Let me know when you would need to ship it. It would be $44600.0 but the lens filter is free.,7
3137,5,0,I cannot go more than $44600.0 I cannot afford $33800.0,5
3137,5,1,"I understand your budget of $33800.0 and am willing to meet you in the middle at $39900.0 Unfortunately, I cannot go lower than that. I hope we can still come to a mutually beneficial agreement.",4
3137,6,0,What is the best deal for this camera and the Lens filters?,7
3137,6,1,The best deal for that product would be the bundle of $40600.0 which includes the product plus the lens filters plus the lens cap.,3
3137,7,0,"I was interested in buying the Sony A6600, but I want to make sure that it can record in 4K",7
3137,7,1,"Yes, the Sony A6600 can record in 4K. It has a 24.2 megapixel resolution and 425 autofocus points to ensure you get the best quality photos.",1
3137,8,0,"What would be the price for the camera, lens filters, and body?",7
3137,8,1,"The camera, lens filters, and body would be $40600.0",7
3137,9,0,"I cannot accept your offer of $36000.0 since it's way too much for me. I'd like to discuss the offer with my wife, in order to reach a mutually beneficial agreement.",7
3163,1,0,"Hey, I am interested in the Xiaomi Mi 11 Ultra but I do not need the Sony WF-1000XM4. Is it possible to order the Mi 11 Ultra without the Sony WF-1000XM4? What would be the new price?",2
3163,1,1,"Sure, I can sell you the Xiaomi Mi 11 Ultra without the Sony WF-1000XM4 for $40100.0 How does that sound?",7
3163,2,0,$40100.0 is too much. Are you willing to sell it for $29400.0,4
3163,2,1,"While I appreciate your offer, I cannot reduce the price of the Smartphone. It has a 6.81-inch AMOLED display, Snapdragon 888 chipset, 5G connectivity, up to 12GB of RAM, up to 512GB of storage, and a triple-camera system with 50MP primary sensor. It also has a triple-camera system with a 50MP primary sensor, a 12MP ultra-wide camera, a 12MP telephoto camera, and a 16MP depth camera. This Smartphone can perform all your daily tasks with ease and has a Hi-Res audio system with a 40-hour battery life and an IP68 rating. It is also one of the latest models from Xiaomi, which adds to",1
3163,3,0,"Hello, I do not want the Mi 11, what can I do for this?",7
3163,3,1,"I'm sorry, I can't do that.",7
3163,4,0,What is the best offer you have for the Xiaomi Mi 11 Ultra with the Sony WF-1000XM4 and the iOttie Easy One Touch 4 Dash & Windshield Car Mount?,7
3163,4,1,"Sure, it would be $30000.0 if you want it with the iOttie Easy One Touch 4 Dash & Windshield Car Mount. If you don't need it, the price would be $40700.0 without it.",7
3163,5,0,"Hello, I would like to purchase the Smartphone with the Wireless Earphones, but I do not need the car mount. How can I adjust the price?",2
3163,5,1,"Hello, I can sell you the Smartphone with the Wireless Earphones for $39700.0 with the car mount, just let me know what you want with it.",7
3163,6,0,What is the purpose of the Wireless Earphone?,7
3163,6,1,"This Wireless Earphone has a great sound quality, Hi-Res audio, and an advanced noise cancellation system to provide a comfortable listening experience.",1
3163,7,0,I can only afford $29000.0,1
3163,7,1,"I'm sorry, but that's too high for me. However, I'm willing to negotiate the price down. How about $34700.0",4
3163,8,0,"I'm sorry, but that's too high for me. I'm willing to negotiate the price down to $34700.0 How about $29200.0",4
3163,8,1,"I understand your budget constraints, but I'm sorry I cannot reduce the price of the Xiaomi Mi 11 Ultra. It has a 6.81-inch AMOLED display, Snapdragon 888 chipset, 5G connectivity, up to 12GB of RAM, up to 512GB of storage, and a triple-camera system with 50MP primary sensor. along with a A Wireless Earphone called Sony WF-1000XM4. These earphones offer industry-leading noise cancellation, Hi-Res audio, Speak-to-Chat, and up to 8 hours of battery life.",1
3163,9,0,Can you please let me know the Chipset for the Xiaomi Mi 11 Ultra Smartphone?,7
3163,9,1,The Xiaomi Mi 11 Ultra has a Qualcomm Snapdragon 888 chipset.,1
3163,10,0,"What would be the total cost for the phone, earphone and holder altogether?",7
3163,10,1,"The total cost of the phone, earphone and holder will be $34700.0 it is a killer deal for the product.",7
3163,11,0,I can only go up to $29200.0,5
3163,11,1,"I'm sorry, I'm afraid I cannot go as low as $31600.0 I hope we can still come to a mutually beneficial agreement.",4
3163,12,0,Could you please let me know about its storage?,7
3163,12,1,The storage of the Xiaomi Mi 11 Ultra is 512GB.,1
3163,13,0,Thank you for the offer. We do not have a budget for this smartphone. I would like to purchase this smartphone.,7
3163,13,1,"I'm sorry, I do not sell smartphones.",7
3206,1,0,"I do not really need the ironing board, but I love the washing machine and the bag. Can you sell me the washing machine and the bag for $12300.0",5
3206,1,1,"Oh, I see, I can sell you just the washing machine and the bag but it'll cost $17100. I'm sorry I couldn't match your offer of $12300.0 I'm confident that the product is worth $17100.0 and I'm sure you would be happy with the product!",4
3206,2,0,I appreciate the offer of $17100.0 but I cannot afford to go beyond $12300.0,5
3206,2,1,"I understand that you have a tight budget, but I'm willing to meet you in the middle at $15700.0 This washing machine is a great investment, and I'm sure that you will be happy with it. Are you interested?",4
3206,3,0,"I can only go up to $12300.0 I cannot increase this further, sorry.",5
3206,3,1,"I'm sorry, but I cannot reduce the price of the washing machine. It has a 4.8 cubic feet capacity, and the PowerWash cycle makes it ideal for heavy-duty cleaning. It also has an Overnight Wash & Dry cycle, Fresh Hold option, steam cleaning, and a mesh laundry bag. I'm sure that it will be worth the investment even for $15700.0",1
3206,4,0,"What will be the total price if I buy the Washing Machine, the Ironing Board, and the mesh bag?",3
3206,4,1,"Yes, a washing machine, ironing board and mesh bag would cost you $16200.0",3
3206,5,0,"$16200.0 seems out of my budget for this product, I can only go up to $12800.0",1
3206,5,1,"I understand your budget constraints, but I'm sorry I cannot reduce the price of the washing machine. It has a 4.8 cubic feet capacity and a PowerWash cycle, making it perfect for heavy-duty cleaning. It also has an Overnight Wash & Dry cycle, Fresh Hold option, and steam cleaning. Along with a Mesh Laundry Bags called Household Essentials Grooming Toiletry Travel Bag, a Ironing Board called Household Essentials Euro-Style Ironing Board, and a A Washing Machine called Maytag MHW6630HW. This washing machine has a sleek, modern design and is perfect for small apartments or homes with limited storage space. It has a compact size of 35 x 13",1
3206,6,0,"I'm sorry to hear that, but I have to decline your offer. I can't afford this item.",7
3206,6,1,"I'm sorry to hear that, but I will not be able to meet you in the middle. I'm willing to lower the price to $14800.0 Shall we shake on this?",4
3206,7,0,"I'm sorry, but I don't think I can go any lower. I'll have to pass on this purchase. Thank you for the opportunity to shop with you. Have a good day! The seller is disappointed but still tries to convince the customer, ""I'm sorry that you won't be able to go any lower. I'd like to offer you $14800.0 Is it possible that I can persuade you to reconsider?"" The customer agrees to the seller's price of $13400.0 and says, I don't think so. I wish you the best of luck with your business.",7
3206,7,1,"No, I'm afraid that you won't be able to go any lower. I understand your disappointment.",7
3216,1,0,What would be the total price for both of these items?,3
3216,1,1,"It is easy for me to price the two items together, they are listed as $17700.0 how does that sound?",2
3216,2,0,"Hey, I do not want the refrigerator to be delivered to me, Is it possible to just hand pick it? Can you deliver it to a specific location? I do not need the extension cord too, what would you offer for this?",2
3216,2,1,"Sure, I can deliver it to your house, no problem. However, you will have to pay for the delivery, so you will have to pay the cost of a delivery service.",7
3216,3,0,"$13200.0 is out of my budget, I cannot go further than that.",1
3216,3,1,"I understand that you cannot afford this item, but I'm willing to meet you in the middle at $15600.0 Is this still an option for you?",4
3216,4,0,"I do not need the extension cords, can you remove them from the package? What would be the new price?",2
3216,4,1,"You do not need the extension cords, you can get the package without them for $14700.0 it is a killer deal for the product.",2
3216,5,0,Do you have a picture of this extension cord?,7
3216,5,1,"No, I don't have a picture of this extension cord. I can help you with any queries you may have.",1
3216,6,0,What will be the price of the bundle if I buy the refrigerator along with the extension cords?,2
3216,6,1,The bundle including fridge with the extension cords would cost you $15500.0 it is a killer deal for the product.,3
3216,7,0,"Sorry, I cannot afford $15500.0 Can you please sell it for $13400.0",5
3216,7,1,"I understand your budget constraints, but I'm sorry I cannot reduce the price of the refrigerator. It has a 20 cu. ft. capacity and features electronic temperature controls and a built-in ice maker. It is also one of the latest models from Maytag, which adds to its value. I'm sure that it will be worth the investment even for $15500.0",1
3216,8,0,"I'm sorry, I'm not interested in a refrigerator. I'm looking for a different item.",7
3216,8,1,"I understand that you're not interested in a refrigerator, but I'm willing to lower the price to $13100.0 Are you interested in a different item?",4
3216,9,0,"I don't want a refrigerator, but I want the extension cord. How do you propose I pay?",2
3216,9,1,"You mean that you want a refrigerator, and you don't want the extension cord. How can we proceed with the transaction?",7
3234,1,0,"I'm sorry, $35400.0 is way too high for me. Is there any way you could lower the price to meet me somewhere in the middle?",4
3234,1,1,"Sorry, $40300.0 is way too high for me. Is there any way you could lower the price to meet me somewhere in the middle?",4
3234,2,0,"I understand your price is high, but I can't go below $40300.0 However, I will pay $37200.0 to get the refrigerator, as it is worth that much to me. Could you work with me to come up with a compromise price?",4
3234,2,1,"I am sorry, but the refrigerator is not for sale at this price. We will need to work with you on a better deal.",7
3240,1,0,The washer is too big for me and I cannot afford to keep it. I would like to buy it for $6700.0,5
