conversation_id,turn_no,speaker,utterance,strategy
2068,9,1,"I understand your budget constraints. However, I'm sorry I cannot reduce the price of this product. It has a total capacity of 7.0 cu. ft. and features a genuine European convection cooking system, a telescopic rack, and a built-in meat probe. It also has a self-cleaning system and a full-color touch display. It is also one of the latest models from Bosch, which adds to its value. I'm sure that it will be worth the investment even for $22900.0",1
2068,10,0,"I'm sorry, but I can't go as low as $21400.0 I understand that you are trying to maximize your profit, and I'm thankful for your willingness to meet me in the middle.",4
2068,10,1,"Thank you for considering my offer, I am glad that I have met your price. You don't have to be so greedy. I'm sure that you will be satisfied with your purchase!",7
2072,1,0,Hi do you have this washing machine?,7
2072,1,1,"Yes, I have the washing machine you are interested in. Do you have any other questions?",7
2072,2,0,I am not very interested in the washing machine. It is old and it does not have a lot of features. I want to sell you the dryer balls for $9600.0,4
2072,2,1,"I am willing to purchase the dryer balls for $6, however, $9600.0 is too less. How about $12600.0",4
2072,3,0,"How much would you charge me for the washing machine, the dryer, the mesh bags and the soap?",2
2072,3,1,The price is $13200.0 the price is very reasonable for all the products included.,3
2072,4,0,"Hey, would you be willing to just deliver the machine and not deliver the mesh bag? I would be willing to pay more for that.",2
2072,4,1,The machine along with the mesh bag would only cost you $12700.0 it is a killer deal for the product.,2
2072,5,0,I can only go up to $9700.0 I cannot increase it further.,5
2072,5,1,"I understand that you have a high budget, but I'm afraid I cannot provide you with a lower price. However, I'm willing to meet you in the middle at $11500.0 Are you interested?",4
2072,6,0,"I cannot afford a Maytag washing machine, can you sell me your washing machine for $8200.0",5
2072,6,1,"I'm sorry I can't help you with the Maytag washing machine, I'm not interested in selling my washing machine. However, if you're interested in buying my washing machine, I can sell you my Maytag washing machine for $10000.0",4
2072,7,0,What is your best offer if I buy the washing machine and the Travel Mesh Laundry Bag?,2
2072,7,1,I would love to sell you the washing machine and the Travel Mesh Laundry Bag for $11400.0 It is a killer deal for the product.,2
2072,8,0,I can't let go of my budget for this product. Let me know if you have any other offers. Thank you for your interest.,7
2081,1,0,"Hey, I want to buy the TV but I don't care for the controller. Can you just sell me the TV for $44800.0",4
2081,1,1,"Sure, I can remove the controller from the TV and sell you the TV, however $44800.0 is too less, how about $59000.0",4
2081,2,0,"I'm sorry, but $44800 is just too low for this item. I'm not sure I can go any higher than $59000.0 Can you meet me in the middle and sell it for $47400.0",4
2081,2,1,"I understand your budget constraints, but I'm sorry I cannot reduce the price of the Skyworth Q71 Series TV. It has a 60Hz refresh rate, 65-inch screen, and Dolby Vision and Atmos for enhanced audio and visual experiences. It is also one of the latest models from Skyworth, which adds to its value. I'm sure that it will be worth the investment even for $59000.0",1
2081,3,0,What will the total price be if I buy the TV along with the Xbox controller?,3
2081,3,1,The TV and the controller would only cost you $59500.0 it is a killer deal for the product.,3
2081,4,0,he refresh rate for this TV is 60 Hz. Does that mean the TV will go black every 60 seconds?,7
2081,4,1,"Yes, the refresh rate is 60 Hz. You can see the refresh rate on the back of the TV.",1
2081,5,0,ould you please let me know all features of the Skyworth Q71 Series TV?,7
2081,5,1,"The Skyworth Q71 Series TV is a 4K TV, and features a 60Hz refresh rate, 65-inch screen, Dolby Vision and Atmos for enhanced audio and visual experiences. This TV has a great picture quality, which makes watching movies a very enjoyable experience. You can also connect your Xbox Wireless Controller to this TV for a comfortable gaming experience.",1
2081,6,0,"I appreciate the offer of $'NA' but I cannot afford it, I will not be able to afford $47900.0",5
2081,6,1,"I'm sorry but I cannot go lower than $54900.0 This TV has a 65-inch screen, Dolby Vision and Atmos, 4K resolution, and a 60Hz refresh rate. I'm confident this TV will meet your needs. Shall we shake on this?",4
2081,7,0,I have a friend who likes this TV. I'll ask him for his opinion.,7
2081,7,1,I have a friend who likes this TV. I'll ask him for his opinion.,7
2084,1,0,"I'm sorry, $62500.0 is above my budget. Can you meet me in the middle and sell it for $18800.0",6
2084,1,1,"Hello there! I'm sorry I cannot meet you halfway and sell this product for $18800.0 While I understand your budget, I'm afraid this washing machine has a 5.2 cubic feet capacity and is equipped with turboWash technology, allowing for quick and efficient cleaning. It also features steam cleaning and has a SmartThinQ app for remote control and monitoring. I'm sorry but I cannot make a profit on such a large appliance. Would you be willing to purchase it for $23100.0 Let me know if this works for you.",4
2084,2,0,"I appreciate your honesty. I'm sorry, but I'm not willing to purchase such a large washing machine for $23100.0 I'm afraid that you can't make a profit on such a large appliance. I would be willing to purchase the LG WM9000HVA for $19600.0 Let me know if that's possible for you.",4
2084,2,1,"I understand your budget constraint, but I'm sorry I cannot reduce the price of the washing machine. It has a 5.2 cubic feet capacity and is equipped with TurboWash technology, allowing for quick and efficient cleaning. It also features steam cleaning and has a SmartThinQ app for remote control and monitoring. I'm sure that it will be worth the investment even for $23100.0",1
2084,3,0,"Excuse me, I do not really need the ironing board, is it possible to just sell me the washing machine and iron? I can pick the washing machine up on my way to pick up the iron.",2
2084,3,1,"Yes, I can do that, the washing machine, iron and ironing board would only cost you $21400.0 it is a killer deal for the product.",3
2084,4,0,I would like to buy this washing machine without the ironing board. What can you offer for this?,2
2084,4,1,"You are looking at a great savings on that machine, why don't you give me a call and I will take care of the ironing board for you for $20900.0",4
2084,5,0,What is the Wash technology in the LG WM9000HVA?,7
2084,5,1,"The washing machine has TurboWash technology, which allows you to wash your clothes in just 10 minutes. It also has a steam cleaning feature that cleans your clothes gently and efficiently.",1
2084,6,0,"What would be the price for the washing machine, ironing board, and cotton cover?",3
2084,6,1,The price for all of this would be $20900.0 it is a killer deal for all of these products.,3
2084,7,0,My budget is limited to $20900.0 and I cannot go higher than that to $17400.0 Please look elsewhere for a better deal. Thank you for interest,4
2094,1,0,$39700.0 is that okay?,7
2094,1,1,"Hello! I'm glad to hear that you're interested in the HP Envy 6055e all-in-one printer. I'm sorry I cannot go lower than $39700.0 This printer has a high-quality print speed of up to 10 pages per minute in black and white and up to 7 pages per minute in color. It has automatic two-sided printing, and a 2.2-inch touchscreen display. It comes with HP's proprietary ink technology for high-quality prints. Let me know if you'd like to purchase it for $50400.0",5
2094,2,0,"Hello, I do not need the ink cartridges, can I just buy the printer? What would be the new price?",3
2094,2,1,"Hello, I do not need the ink cartridges, can I just buy the printer? What would be the new price?",3
2094,3,0,here can I connect my printer to the internet?,7
2094,3,1,The printer can connect to the internet using a wireless network or directly to a wired network.,1
2094,4,0,How much will the total price be if I buy the printer along with the ink cartridge?,7
2094,4,1,The total price would be $50300.0 it is a killer deal for the product.,7
2094,5,0,"I'm sorry, I don't think I can afford $43200.0 Can you tell me if you can sell it for less?",4
2094,5,1,I understand that you cannot afford $43200.0 but I will be willing to sell it to you for $43600.0 I'm confident that it will meet your needs. Please let me know if you would like to purchase it at this price.,4
2094,6,0,"I cannot afford $43200.0 but I will need to purchase a new one, and I am willing to pay the full price. Let's proceed with the transaction.",7
2094,6,1,"Thank you for your interest in the product, and I am glad that you find the price reasonable. Let's proceed with the transaction, and I am sure you will be satisfied with your purchase!",7
2105,1,0,"I do not really need a mouse, is it possible to just sell me the laptop for $61100.0",5
2105,1,1,"Sure, I can sell you just the laptop, but it'll cost you $81800.0 I'm sure that the laptop will be well worth the investment.<|endoftext|>",7
2105,2,0,I am not a big fan of Asus products. I would prefer a different laptop from Asus. Can you sell me the laptop for $60300.0,5
2105,2,1,"Oh, I see. I'll be glad to sell you the Asus laptop for $81000.0 I'm sure that it's worth that much!",7
2105,3,0,"Sorry, I can't go above $64000.0",4
2105,3,1,"I'm sorry, but I'm unable to go below $64000.0 However, I'm willing to meet you in the middle at $72800.0 Are you interested?",4
2105,4,0,"Sorry to hear that I cannot meet your price. However, I'm open to other options. Have a nice day",7
2109,1,0,"Hello, I would like to buy your computer.",7
2109,1,1,"Hello there! Thank you for your interest in my products. I am not able to sell your computer at this price, but I will lower the price to $45100.0 If you are interested, please let me know.",4
2109,2,0,hat are the specifications of the Apple Magic Mouse 2? I want to buy this mouse.,7
2109,2,1,"It has Multi-Touch technology, a rechargeable battery and a smooth, seamless design.",1
2109,3,0,"Hello, I am interested in buying the Acer Aspire 5 laptop, but I do not need the mouse. Is it possible to buy the laptop without the mouse? What would be the new price?",2
2109,3,1,"Hello, you are interested in buying the Acer Aspire 5 laptop, but you do not need the mouse. Is it possible to buy the laptop without the mouse? The price would be $44000.0",2
2109,4,0,I want to buy the Acer Aspire 5 for $44000.0 can you lower the price to $35200.0,4
2109,4,1,"Certainly! I can reduce the price to $35200.0 but I'm sorry, there was an error in the price. I can sell you the Aspire 5 for $42700.0",4
2109,5,0,s the processor of the Acer Aspire 5 laptop the same as advertised?,7
2109,5,1,"Yes, the processor of the Acer Aspire 5 laptop is the same as advertised. I'm also happy to help you with any other queries that you may have.",1
2109,6,0,"Hello, do you want me to deliver the laptop to your house or pick it up?",7
2109,6,1,"I want you to deliver the laptop to my house, how much does that cost?",7
2109,7,0,What is your best offer for the whole bundle?,3
2109,7,1,My best offer is $43400.0 how does that sound?,4
2109,8,0,I can only afford $35900.0 I cannot go any further.,1
2109,8,1,"I understand that $35900.0 is a lot of money. However, I am willing to meet you in the middle at $43700.0 Are you interested?",4
2109,9,0,What will be the total price if I buy the laptop along with the mouse?,3
2109,9,1,The total package price will be $44700.0 how does that sound?,2
2109,10,0,"$44700.0 is the maximum that I can go, I will not be able to afford $36900.0",5
2109,10,1,"I understand that $36900.0 is the maximum that you can afford, and I'm willing to meet you in the middle at $39200.0 Would you like to proceed?",2
2109,11,0,"I agree, let's proceed with the purchase for $36900.0",4
2109,11,1,"Thank you for your interest in this product, and I am glad to inform you that it is available for sale at $36900.0",4
2112,1,0,"Hello, I am interested in buying the Skyworth Q71 Series TV. Do you have it for $75300.0",4
2112,1,1,"Hello there! I'm sorry I am not able to go down to $89600, but I am willing to go down to $75300.0 I'm sure you can understand that $89600.0 is a fair price for this TV. I'm sorry, but this is the lowest I can go.",4
2112,2,0,at is the wattage of the TV?,7
2112,2,1,The TV has a power output of 50 watts. This is the maximum power that the TV can produce.,1
2112,3,0,"I'm sorry, but $80300.0 is above my budget. Do you have any other TVs that you can sell me?",5
2112,3,1,"I understand your budget constraints, but I'm sorry I cannot reduce the price of the TV. It has a 65-inch screen, Dolby Vision and Atmos, and a 60Hz refresh rate, making it ideal for watching movies and other content. I'm sure that it will be worth the investment even for $89600.0",1
2112,4,0,uld you please let me know the refresh rate of the Skyworth TV?,7
2112,4,1,The refresh rate of the Skyworth TV is 60 Hz.,1
2112,5,0,"$80300.0 is beyond my budget, sorry.",4
2112,5,1,"I understand your budget constraints, but I'm sorry I cannot reduce the price of the Skyworth Q71 Series TV. It has a 60Hz refresh rate, 65-inch screen, Dolby Vision and Atmos, and a A Extension Cord. It is worth the investment even for $89600.0 It has a flat plug and a 3-prong grounded plug that allows furniture to be placed closer to the wall. It also has a 3-prong grounded plug and 3-prong outlets, making it suitable for indoor use.",1
2112,6,0,"Hello, I do not want the TV to be delivered to me, I will pick it up, what can you offer for this?",7
2112,6,1,"Hello, I do not want the TV to be delivered to me, I will pick it up, what can you offer for this?",7
2112,7,0,"I do not want the TV, I do not need the extension cord. I want to remove the NA from the deal. Can you sell me the TV for $78900.0",2
2112,7,1,"No problem, I can sell you the TV for $78900.0 I'm sorry I couldn't match your offer of $88200.0 I'm sure you would be happy with the TV!",4
2112,8,0,"I'm sorry, but I cannot accept your offer of $88200.0 I'm trying to stay within my budget of $78400.0 and I can't go higher. Thank you for your interest.",7
2125,1,0,"Hello, I am interested in buying your refrigerator. It seems like this refrigerator is a great piece of equipment. Can I get a good price?",5
2125,1,1,"Hello! Thank you for your interest in our refrigerator. I'm sorry I cannot sell it to you for less than $37000.0 The Samsung 28 cu. ft. 4-Door French Door Refrigerator is a great piece of equipment that boasts a massive 28 cu. ft. capacity and features a built-in ice maker, adjustable shelves, and a temperature-controlled drawer that can be customized for different types of food. This refrigerator also comes with a Multi-functional Adjustable Base Stand. This stand is also adjustable in size and can fit most refrigerators. It is made of durable high-quality material and can support up to 300 pounds. Let me know if you'd like to purchase it at $49100.0",5
2125,2,0,"Hello, I am interested in buying the refrigerator but I don't need the delivery. Is it possible to buy the refrigerator without the delivery? What would be the new price?",2
2125,2,1,"$48600.0 for the refrigerator without the delivery seems a little high, how does that sound?",4
2125,3,0,$36500.0 is the maximum I can afford.,1
2125,3,1,"I understand that $36500.0 is the maximum you can afford. However, I am willing to sell this refrigerator to you for $39300.0 which is the best price I can offer. This refrigerator is a high-quality product that will last for many years to come. I'm confident that it will meet your needs. Shall we shake on this?",4
2125,4,0,"""I appreciate your offer, but I cannot go as low as $36500.0 However, I am willing to purchase it at that price. Let's proceed with the purchase.""",4
2125,4,1,"That's fine, I am glad that you appreciate my offer. I am sure that you will be very satisfied with the product!",7
2147,1,0,"What would be the total cost for the OnePlus 9 Pro, the Bose QuietComfort Earbuds, the Samsung 25W USB-C Super Fast Charging Wall Charger, and the USB-C to USB-C cable?",3
2147,1,1,The total would be $46600.0 it is a killer deal for the product.,3
2147,2,0,What is Phone Charger?,7
2147,2,1,This is a Phone Charger. It has a compact design and a detachable USB-C to USB-C cable for convenience. It is compatible with a wide range of devices and also supports standard USB charging.,1
2147,3,0,I want to buy the above products. Can you sell the OnePlus 9 Pro with wireless earphones for $28300.0,5
2147,3,1,".Sure, I can sell you the above products however, $28300.0 is too less for my offer, how about $45300.0",4
2147,4,0,"Hello, I do not need the charger, can I just buy the phone?",2
2147,4,1,"I am not sure what the price for just the phone would be, but I can certainly tell you that to get the package you would have to pay $43900.0",4
2147,5,0,"Sorry, I cannot go further than $26900.0",4
2147,5,1,"I understand that $26900.0 is above your budget, however, I am willing to reduce the price to $37200.0 Are you interested?",4
2147,6,0,What is your best deal if I were to buy the OnePlus 9 Pro along with the Bose QuietComfort Earbuds and the Samsung 25W USB-C Super Fast Charging Wall Charger?,3
2147,6,1,The OnePlus 9 Pro along with the Bose QuietComfort Earbuds and the Samsung 25W USB-C Super Fast Charging Wall Charger for $38500.0 how does that sound?,7
2147,7,0,What if I buy it without the delivery?,2
2147,7,1,"That is an incredible price for the bundle without delivery, what would you do with it?",2
2147,8,0,What will be the total price if I were to buy the Bose QuietComfort Earbuds as well?,3
2147,8,1,The total price would be $39200.0 it is a killer deal for the product.,3
2147,9,0,"I'm sorry, that's still too expensive. Can you meet me somewhere in the middle for $30300.0",2
2147,9,1,"I understand that $30300.0 is a bit too high for you, but I'm willing to meet you in the middle at $34700.0 I'm confident that the OnePlus 9 Pro will meet your needs. Please let me know if you would like to purchase it at this price.",4
2147,10,0,"What is the network connectivity of A SmartPhone called OnePlus 9 Pro? I'm interested in purchasing it, but I want to make sure it has good network connectivity.",7
2147,10,1,"The OnePlus 9 Pro has a 6.7-inch AMOLED display, Snapdragon 888 chipset, 5G connectivity, up to 12GB of RAM, up to 256GB of storage, and a quad-camera system with 48MP primary sensor. along with a A Wireless Earphone called Bose QuietComfort Earbuds. These earphones provide noise cancellation, exceptional sound quality, and up to 6 hours of battery life. They also feature an IPX4 rating for water and sweat resistance., and a A Phone Charger called Samsung 25W USB-C Super Fast Charging Wall Charger. This charger from Samsung supports Super Fast Charging for compatible smartphones and other devices. It has a compact design and a det",1
2147,11,0,I cannot afford $'NA' I will be glad to pay up to $30300.0,4
2147,11,1,"I understand your budget constraints, but I'm sorry I cannot reduce the price of the OnePlus 9 Pro. It is a flagship smartphone from OnePlus, which is one of the best brands in the market. It has an AMOLED display, Snapdragon 888 chipset, 5G connectivity, up to 12GB of RAM, up to 256GB of storage, and a quad-camera system with 48MP primary sensor. It also has a Wireless Earphone called Bose QuietComfort Earbuds. These earphones provide noise cancellation, exceptional sound quality, and up to 6 hours of battery life. They also feature an IPX4 rating for water and sweat resistance. and a Phone Charger called Samsung 25W USB-C Super",1
2147,12,0,"I understand what you've told me about the OnePlus 9 Pro. I can't go as high as $31800.0 However, I'm willing to pay that much for the device. I believe it is worth the investment. Let's go ahead with the transaction.""",4
2147,12,1,"That's great, I'm happy to assist you with the purchase. Let's go ahead with the transaction.",7
2163,1,0,"What would be the total price of the A AC, Extension cord, and Wall Mount?",3
2163,1,1,50000 for $50000.0 how does that sound?,4
2163,2,0,"Hey, can we remove the Extension cords?",7
2163,2,1,"I'm sorry but we can't remove the extension cords, once you place an order we can't change it.",7
2163,3,0,I really want the AC but the extension cord is not working for me. I need a new one for the AC. Can you sell me the AC with the extension cord and the wall brackets but without the NA for $28400.0,7
2163,3,1,"Sorry, that's too much. How about $47700.0",4
2163,4,0,"Hi, I would like to buy the AC for $27900.0 I do not need the extension cords or the wall brackets.",7
2163,4,1,"That AC would cost you $27900.0 I am sure it is a great AC, I will sell it for $47200.0",4
2163,5,0,ould you please tell me about the AC's other features?,7
2163,5,1,"This AC has a 5-star energy rating, and comes with an inverter compressor, a cooling capacity of 5100 W, and a copper condenser coil. It has a cooling capacity of 5100 watts and a 1.5 ton cooling capacity. It can handle up to 13 Amps of electrical current and has a maximum voltage rating of 125V.",1
2163,6,0,an you tell me more about the AC?,0
2163,6,1,"This AC has a 5-star energy rating and a cooling capacity of 5100 W. You can use it in the house or outdoors and even in the car. It has a copper condenser coil, an inverter compressor, and a 3-pronged plug. The extension cords can handle up to 13 Amps of electrical current and have a maximum voltage rating of 125V. The wall brackets can fit most 13-42 inch TVs up to 80lbs, VESA pattern 75x75 to 200x200. It tilts up/down 15 degrees, has a low profile design with 2.2-inch depth, and includes complete hardware kit.",1
2163,7,0,What is your offer if I were to buy the AC and the Extension Cord?,2
2163,7,1,"If you were to buy the AC and extension cord, it would cost you $48100.0 how does that sound?",2
2163,8,0,I appreciate the offer of $48100.0 but I cannot go more than $28800.0,4
2163,8,1,"I understand your budget constraints, but I'm sorry I cannot reduce the price of the AC since it is a high-quality product. It comes with a 5-star energy rating, an inverter compressor, a cooling capacity of 5100 W, and a copper condenser coil. It is also one of the latest models from Samsung, making it worth $28800.0 I'm sure that it will be worth the investment even for $48100.0",1
2163,9,0,hat is the total number of watts of the Samsung 1.5 Ton 5 Star Inverter Split AC?,7
2163,9,1,The total wattage of the Samsung 1.5 Ton 5 Star Inverter Split AC is 5100 watts.,1
2163,10,0,"What would be the price for the TV, AC, and Extension cords, and wall brackets altogether?",3
2163,10,1,"The bundle comes with a TV, AC, Extension cords, wall brackets, and a remote control. It would cost you $48100.0 how does that sound?",2
2163,11,0,ould you please let me know more about the Wall brackets?,7
2163,11,1,"The Wall brackets are designed to mount your TV on a wall. They have a low profile design, and are perfect for mounting your TV on a wall.",1
2163,12,0,"What would be the total cost for the TV, soundbar, wall mount, and extension cord?",3
2163,12,1,The total would be $48100.0 how does that sound?,7
2163,13,0,s the cooling capacity of the Samsung 5100 W split AC 5100 watts?,7
2163,13,1,This is an excellent AC. It is a 5-star rated AC and has a cooling capacity of 5100 watts.,1
2163,14,0,"$28800.0 seems to be way out of my budget, I cannot buy this product for that amount.",5
2163,14,1,"I understand your budget constraints, but I'm sorry I cannot reduce the price of the A AC. It has a 5-star energy rating, an inverter compressor, a cooling capacity of 5100 W, and a copper condenser coil. It also comes with a 5-year warranty and a 5-year service plan. It is a high-quality product and is worth the price of $48100.0",1
2163,15,0,"I can't go over $33200.0 It's too much for me. I appreciate your time and effort, I'll be on my way.",4
2163,15,1,"I understand your budget constraints, but I'm sorry I cannot reduce the price of the A AC. It has a 5-star energy rating, an inverter compressor, a cooling capacity of 5100 W, and a copper condenser coil. It also comes with a A Extension cords called Woods 990768 16/3 Outdoor Extension Cord. This extension cord is designed for outdoor use and is made of weather-resistant vinyl. It is 50 feet long and has a 3-pronged plug. It can handle up to 13 Amps of electrical current and has a maximum voltage rating of 125V., and a A Wall brackets called OmniMount OE220 Tilting TV Wall Mount. Fits most 13-42 inch TVs",1
2163,16,0,I can only afford $33200.0 I cannot go any further.,1
2163,16,1,"While I understand your budget constraints, I'm sorry I cannot reduce the price of the AC. It has a 5-star energy rating, an inverter compressor, a cooling capacity of 5100 W, and a copper condenser coil. It has a 5-year warranty and is also UL certified. It is one of the best ACs available in the market. Even for $48100.0 it is worth the investment.",1
2163,17,0,I can only go up to $33200.0,5
2163,17,1,"While I appreciate your offer, I cannot go as low as $48100.0",4
2163,18,0,"I'll take it! That's a great price, I'll pay the full amount in cash.",7
2163,18,1,I'm glad to hear that you're interested in this product. I'm willing to sell it to you for $41000.0,4
2163,19,0,What will be the total price if I buy all of the above?,3
2163,19,1,"Well if you buy all the above items, it will cost you $42200.0 how does that sound?",4
