conversation_id,turn_no,speaker,utterance,strategy
9,1,0,Is the display of the OnePlus 9 Pro screen type AMOLED?,7
9,1,1,"Yes, the display of the OnePlus 9 Pro is an AMOLED screen.",1
9,2,0,I have no idea how to interpret that information. I will need to look into it more.,7
9,2,1,"I understand your budget constraints. However, I'm sorry I cannot reduce the price of the OnePlus 9 Pro. I'm sure that it is worth $31400.0 It has a 6.7-inch AMOLED display, Snapdragon 888 chipset, 5G connectivity, up to 12GB of RAM, up to 256GB of storage, and a quad-camera system with 48MP primary sensor. It also has a compact and comfortable design, making it ideal for everyday use. I'm sure that you will be pleased with it even for $42000.0",1
9,3,0,"$31400.0 is the biggest amount that I can go, I can afford it.",5
9,3,1,"I understand that $31400.0 is too high for you. However, I'm willing to meet you in the middle at $33800.0 Is this acceptable?",4
9,4,0,"I do not want to buy the delivery from you, can we modify the deal and just buy the phone?",2
9,4,1,"I would be happy to modify the deal - I can do anything for you, you are my customer.",7
9,5,0,What are the SmartPhone features of the OnePlus 9 Pro?,7
9,5,1,"The Smartphone features include a 6.7-inch AMOLED display, Snapdragon 888 chipset, 5G connectivity, up to 12GB of RAM, up to 256GB of storage, and a quad-camera system with 48MP primary sensor.",1
9,6,0,Does the OnePlus 9 Pro include 5G network connectivity?,7
9,6,1,"Yes, the OnePlus 9 Pro includes 5G network connectivity.",1
9,7,0,I can afford the price of $30900.0,5
9,7,1,"I'm glad to hear that, I can assure you that you will be happy with your purchase. Let's proceed with the transaction!",7
13,1,0,at other features does the HP Envy 6055e printer have?,7
13,1,1,"The HP Envy 6055e printer has the following features. Wireless connectivity, automatic two-sided printing, and a 2.2-inch touchscreen display. It has a print speed of up to 10 pages per minute in black and white and up to 7 pages per minute in color. along with a A Ink or toner cartridges called Brother LC3013BK Ink Cartridge. This black ink cartridge is compatible with Brother MFC-J491DW, MFC-J497DW, MFC-J690DW, MFC-J895DW printers. It features Brother's Innobella ink technology for high-quality and vivid prints., and a A Wireless adapters called Linksys WUSB6300.",1
13,2,0,What would be the price for this printer along with this ink or toner cartridges and this wireless adapter?,7
13,2,1,"The printer, along with the ink and toner, the wireless adapter and the power cord, the total is $34300.0",7
13,3,0,"the printer compatible with multiple operating systems, such as Windows and Mac?",7
13,3,1,"Yes, the printer is compatible with multiple operating systems. Is there anything else I can help you with?",1
13,4,0,"customer is negotiating with a seller about a product. The customer wants to ask for another deal to the seller. The initial deal was a printer called HP Laserjet Pro M255wprn. This color laser printer is designed to print all your documents, photos, and graphics with confidence. It provides a fast and reliable printing experience, and it is designed to work with a wide range of applications. Print your documents with professional quality, high-gloss paper, or an optional high-capacity toner cartridge. Print, scan, copy, and fax with a wireless network and a duplexer. The price for this deal was $23800.0 The customer wants to remove the toner cartridge from the deal.",7
13,4,1,"Since the customer wants to remove the toner cartridge from the deal, the price of the bundle will now be $33800.0",3
13,5,0,"Hi, I would like to buy the printer but I do not need the ink or toner. What can you offer?",7
13,5,1,"Well, I can offer you the printer for $22800.0 and the toner and ink for $32800.0 how does that sound?",7
13,6,0,"I do not want this printer, can you sell me the printer for $22200.0",5
13,6,1,"Oh I see, I can remove the printer from the bundle and sell you the printer, two printers, a scanner, and a printer stand for $32200, but $22200.0 is too less! How about $32200.0",4
13,7,0,"$22200.0 is the highest that I can go, I am sorry, but I am unwilling to buy this product.",4
13,7,1,"I understand that you are unwilling to spend that much on a printer. However, I'm sure that the HP Envy 6055e will meet your expectations, since it is the latest model from HP and is also a great value for the money. It has a 2.2-inch touchscreen display, which makes it easy to use. It also has a print speed of up to 10 pages per minute in black and white and up to 7 pages per minute in color. It has a wireless connectivity with a 2.4GHz/5GHz dual-band Wi-Fi, 802.11ac standard, up to 867Mbps wireless speeds, selectable dual-band, internal antenna, USB 3.0 interface.",1
13,8,0,Could you please tell me about the Ink or toner cartridges?,7
13,8,1,"These ink or toner cartridges are compatible with Brother MFC-J491DW, MFC-J497DW, MFC-J690DW, MFC-J895DW printers. It features Brother's Innobella ink technology for high-quality and vivid prints.",1
13,9,0,What is your best offer for this product?,7
13,9,1,The best offer for this product is $33100.0,6
13,10,0,What will be the total price if I were to buy the printer along with the ink cartridges and the wireless adapter?,7
13,10,1,"$33600.0 total, how does that sound?",7
13,11,0,Let me know about the wireless adapters with this printer?,7
13,11,1,This printer comes with wireless adapters. Does that answer your question?,1
13,12,0,"I'm sorry, but I will not accept your offer of $'NA' since my budget is limited to $24900.0 Good bye",7
18,1,0,"Hello, I am interested in buying the Samsung AC, but I do not need the wall bracket. Is it possible to buy the AC without the wall bracket? What would be the new price?",2
18,1,1,"Yes, the AC without the wall bracket would be $30100.0 that is a killer deal for the product.",3
18,2,0,What is your offer if I buy the AC along with the brackets?,2
18,2,1,For the AC it will be $24500.0 for the brackets I will sell you for $31000.0 it is a killer deal.,2
18,3,0,"$24500.0 is the maximum that I can afford for this product, I cannot go any higher.",5
18,3,1,"I understand that $24500 is the maximum you can afford for this product, and I'm willing to meet you in the middle at $24500.0 This is a top-of-the-line product, and it will meet your needs. However, I cannot go any lower than $28400.0 Shall we shake on this?",4
18,4,0,"I understand that $26600 is the maximum you can afford for this product, and I'm willing to meet you in the middle at $28400.0 This is a top-of-the-line product, and it will meet your needs. However, I cannot go any lower than $26600.0 Shall we shake on this?""",4
18,4,1,"Sure, I'm willing to meet you in the middle at $26600.0 Is that okay with you? Shall we proceed to checkout?",4
18,5,0,"Sure, I'm willing to go to $26600.0 Is that okay with you?",4
18,5,1,"I am grateful for your enthusiasm and I'm confident that you will be satisfied with your purchase, but I will have to decline.",7
37,1,0,"I'm sorry, but $44600.0 is still a bit too high for me. Can you give me a discount and sell it for $9800.0",4
37,1,1,"Hello there! Thank you for your interest in the Viking VEDO5302SS. I'm sorry, but I'm not able to go down to $9800.0 If you are interested in purchasing it for $10500.0 please let me know.<|endoftext|>",7
37,2,0,"will pay the amount you quote me within the next 24 hrs.""",7
37,2,1,"Thank you, I'm glad that you find the product to be satisfactory. I am confident that you will be satisfied with your purchase. We can now proceed with the transaction!",7
42,1,0,"I appreciate that you need to make a profit on this item, but unfortunately, $43200 is above my budget for a A AC. I was ideally hoping to purchase the Godrej 1.5 Ton 3 Star Split AC for $38300.0 but I'm willing to negotiate up to $43200.0 Is there any way you could lower the price to meet me somewhere in the middle?",4
42,1,1,"Yes, there is a way to lower the price. I can take a discount of $43200.0 on the price if you are willing to pay me $48800.0",4
42,2,0,"Hello, can we remove the delivery from the deal? How much would it cost?",2
42,2,1,"Hello, you can remove the delivery from the deal. How much would it cost?",2
42,3,0,"Hello, I do not need the extension cords. Can I buy the AC with just the fan and a wall mount? What will be the new price?",2
42,3,1,"Oh, I am sorry. The fan and the wall mount only cost $47000.0 but you can't buy it unless you add in the extension cords, it is a complete package.",2
42,4,0,What is your best offer if I buy the extension cord as well?,2
42,4,1,"Start, why don't you buy the extension cord for $48200.0 it's a killer deal.",2
42,5,0,"Okay, I'll buy the extension cord for $43900.0",4
42,5,1,"Thank you for buying the extension cord, I am sure that you will be happy with the quality of the product. Let us go ahead with the transaction.",7
53,1,0,I can't afford $60900.0 Is there any way you could get me a deal and sell it to me for $58900.0,5
53,1,1,Hello! I can't afford $58900.0 Is there any way you could get me a deal and sell it to me for $63100.0,5
53,2,0,What is the Warranty of the cover?,7
53,2,1,The warranty of the cover is a 1 year warranty. What other questions do you have?,1
53,3,0,"What would be the total price for the refrigerator, cover, and both?",3
53,3,1,"The total price for the fridge, cover, and both would be $63100.0 Thanks for your interest, please let me know if you have any questions.",3
53,4,0,I'll have to get back to you on that. Thank you.,7
53,4,1,"Thank you for contacting me, I will let you know as soon as I have the information you require. Have a great day!<|endoftext|>",7
54,1,0,How much does the Asus ROG Zephyrus G14 laptop cost?,7
54,1,1,The Asus ROG Zephyrus G14 laptop is available for purchase at $'NA',1
54,2,0,"$76700.0 is not a realistic budget for this product, I cannot afford to buy it.",5
54,2,1,"I understand your budget constraints, but I'm sorry I cannot reduce the price of the Asus ROG Zephyrus G14. It has a 14-inch display, AMD Ryzen 9 processor, and up to 32GB of memory. It also comes with a dedicated Nvidia GeForce graphics card and a long battery life. It also features a Logitech K810 Wireless Bluetooth Illuminated Multi-Device Keyboard, a Sony WH-1000XM4, and a A Headphone called Sony WH-1000XM4.",1
54,3,0,I would like to buy the laptop but I do not need the keyboard. What can I offer?,2
54,3,1,"Sure, just add a keyboard and the laptop is yours for $117300.0 It is a killer deal!",2
54,4,0,I really like the Asus ROG Zephyrus G14 but I cannot afford it. Can you sell me the Asus ROG Zephyrus G14 for $74900.0,5
54,4,1,"Yes, I can sell you the Asus ROG Zephyrus G14 for $74900.0 however, I'm sorry I cannot match your offer of $116000.0",4
54,5,0,What is the processor of the Asus ROG Zephyrus G14?,7
54,5,1,"The Asus ROG Zephyrus G14 laptop features an AMD Ryzen 9 processor, with up to 32GB of memory.",1
54,6,0,"What is your offer if I were to buy the A Laptop, A Keyboard and A Headphone?",3
54,6,1,"The only thing that is missing is a power cord for the computer, we would charge you $117200.0 for the package.",7
54,7,0,I can only afford $76100.0 sorry.,5
54,7,1,"I'm sorry, I cannot go lower than $76100.0 I hope you will be able to meet me in the middle at $100600.0",4
54,8,0,What is the display of the Asus ROG Zephyrus G14 laptop?,7
54,8,1,The Asus ROG Zephyrus G14 laptop has a 14-inch display with a resolution of 1920x1080.,1
54,9,0,"What would be the price for the laptop, keyboard, and headphones?",3
54,9,1,"Well, the laptop and the keyboard along with the headphones would only cost you $100600.0 it is a killer deal for the product.",3
54,10,0,"Hello, I am interested in buying the laptop, but I do not need the keyboard and the headphones. Is it possible to buy just the laptop? What would be the new price?",2
54,10,1,"Sure, just type in the keyword laptop into our search box, you can get the laptop for just $100000.0",4
54,11,0,"I'm sorry, but I can't afford $100,000 for a laptop. I can only afford $100000.0 Is there any way you could lower the price to $83100.0",5
54,11,1,"I understand your budget constraints, but I'm sorry I cannot reduce the price of the Asus ROG Zephyrus G14. It has a 14-inch display, AMD Ryzen 9 processor, and up to 32GB of memory. It also comes with a dedicated Nvidia GeForce graphics card and a long battery life. It also has a keyboard, a headset, and a mouse, making it a complete package. I'm sure that it will be worth the investment even for $100000.0",1
54,12,0,I can only go up to $100000.0 I cannot afford $83100.0,5
54,12,1,I appreciate your budget. I'm willing to reduce the price to $100600.0 Are you interested?,4
54,13,0,"What will be the total price if I buy the Asus ROG Zephyrus G14 along with a keyboard, a mouse, a headset, and a Saucer?",3
54,13,1,The total price of the bundle would be $101100.0 how does that sound?,2
54,14,0,"I cannot afford this product, I can only go up to $83600.0",5
54,14,1,"I understand your budget constraints. However, I'm sorry I cannot lower the price of the laptop. It has a 14-inch display, AMD Ryzen 9 processor, and up to 32GB of memory. It also comes with a dedicated Nvidia GeForce graphics card and a long battery life. It is also a great gaming laptop and is worth the price of $101100.0",1
54,15,0,"I understand your response and your laptop seems like a good deal. However, my budget is limited to $88900.0 and I cannot go any higher than that. Good bye",7
82,1,0,"Hello, I am interested in buying the TV but I do not need the TV stand. Is it possible to buy the TV without the stand? What would be the new price?",2
82,1,1,"Of course, it's possible to buy the TV without the stand. You can buy the TV for $16100.0 including the stand.",3
82,2,0,I can only go up to $13800.0 I cannot increase it further.,1
82,2,1,I'm afraid that $13800.0 is still too high for me. I'm willing to reduce the price to $15200.0 Are you interested?,4
82,3,0,"I do not need the TV Stand, is it possible to just sell me the TV and the extension cord?",2
82,3,1,"If you do not want the TV Stand, I can certainly sell you the TV and extension cord for $14700.0 How does that sound?",4
82,4,0,"I like the TV, but I do not want the stand. Is there any way you can sell the stand alone for $13800.0",5
82,4,1,"You're right, I can sell the stand for $13800.0 Let me update the price of the TV.",7
100,1,0,"I really like the NA but I cannot afford the ONA, can you sell me the camera for $41400.0",4
100,1,1,"Sure, I can remove the ONA from the bundle and sell you the camera for $49600.0 It's a good deal!",2
100,2,0,What is the total price if I buy this camera along with the external hard drive and the strap?,3
100,2,1,The total price would be $50100.0 it is a killer deal for the product.,3
100,3,0,"That's a lot of money. I'm not sure if I can afford that, I was hoping to purchase the Fujifilm X-T4 for $50100.0 but I'm willing to negotiate up to $43400.0 if necessary. Is there any way you could lower the price to meet me somewhere in the middle?",4
100,3,1,"I understand your budget constraints, but I'm sorry I cannot go as low as $4400. The Fujifilm X-T4 is a high-quality camera that is worth the price of $43400.0 It has a mirrorless design, 26.1 megapixel resolution, and a powerful processor which makes it ideal for photography enthusiasts. It is also one of the latest models from Fujifilm, which adds to its value. I'm sure that it will be worth the investment even for $50100.0",4
100,4,0,"Excuse me, I do not need the delivery. Can we modify the deal and just sell me the camera without the delivery? How much would it cost?",2
100,4,1,"Sure, the camera alone would be $49600.0 but the delivery would cost you a lot more. How does that sound?",7
100,5,0,Please tell me about the camera strap.,7
100,5,1,This stylish leather strap is perfect for those who want to add a touch of sophistication to their camera gear. It features a wide neck pad for comfort and adjustable length for a custom fit. It also has a wide neck pad for comfort.,1
100,6,0,"I'm sorry, but I'm not interested in this. I'm looking for a Canon EOS 50D.",7
100,6,1,"I understand your budget constraints, but I'm sorry I cannot reduce the price of the Fujifilm X-T4. It is a high-quality, mirrorless digital camera that has a 26.1 megapixel resolution, 425 autofocus points, 5-axis in-body image stabilization, 15fps continuous shooting, 4K video recording, and a A Camera strap called ONA The Presidio Camera Strap. It also features password protection and automatic backup software. This stylish leather strap is perfect for those who want to add a touch of sophistication to their camera gear. It features a wide neck pad for comfort and adjustable length for a custom fit. It is also available in a variety of storage capacities ranging from",1
100,7,0,"I appreciate your recommendation, but I cannot spend that much money on a camera. I'll take the camera for $49600.0 and the A Camera strap for $45100.0",7
100,7,1,"I'm glad that you find my camera recommendation useful. I'm sure that you will have a great camera experience with the camera, and the camera strap will be very convenient for you. Let's proceed with the transaction.",7
103,1,0,"Hello, I would like to buy the A camera but I do not need the A camera bag. Is it possible to just buy the A camera? What will be the new price?",2
103,1,1,The A camera along with the A camera bag would only cost you $30500.0 it is a killer deal for the product.,3
103,2,0,"I do not want to buy this camera, I just want to buy the bag with the camera. Can you sell me the camera for $19000.0",5
103,2,1,"Certainly! I can sell you just the camera and the bag, however, $19000.0 is too much. How about $29900.0",4
103,3,0,"Thank you for considering my offer. However, I cannot go down from $19000.0 because it's beyond my budget. I'll look for other options. Good bye",7
106,1,0,"Hi, I'm interested in buying your AC, but I was hoping to get a better price. Can you offer it to me for $18700.0",4
106,1,1,"Hello, I appreciate your interest in the AC. However, I'm sorry this is not the best price I can offer at this time. This is a 5-star rated AC that is energy efficient and can cool a home of up to 5000 W. This means it will not heat up your home too much, but it is still capable of cooling your home in Summer. It has Wi-Fi connectivity, an inverter compressor, and an extension cord called Cable Matters 2-Pack 16 AWG Heavy Duty 3 Prong AC Power Extension Cord. This pack includes two 6-foot long extension cords that have a 3-pronged plug. They are made of sturdy PVC and can handle up to 13 Amps of electrical current",7
106,2,0,"I'm sorry, but I'm unable to go down to $19800 for this item. I appreciate that you need to make a profit on this item, but unfortunately, $19800 is above my budget for this item. I was ideally hoping to purchase this AC for $24600.0 but I'm willing to negotiate up to $19800.0 if necessary. Is there any way you could lower the price to meet me somewhere in the middle?",4
106,2,1,"I understand your budget constraints, but I'm sorry I cannot reduce the price of the AC since it is a high-quality product. It has a 5-star energy rating, Wi-Fi connectivity, a cooling capacity of 5000 W, and an inverter compressor. It has a built-in AC compressor, which is ideal for saving energy. It is also a very sturdy product, which makes it ideal for use in a home or office. I'm sure that it will be worth the investment even for $24600.0",1
106,3,0,"I appreciate the offer, but I cannot afford it.",1
106,3,1,"I understand your budget constraints, but I'm sorry I cannot reduce the price of the AC. It has a 5-star energy rating, Wi-Fi connectivity, a cooling capacity of 5000 W, and an inverter compressor. It also has a 2-year warranty. It is also one of the newer models from Daikin, which adds to its value. I'm sure that it will be worth the investment even for $24600.0",1
106,4,0,"Hello, I do not need the delivery of the AC. Is it possible to just give me the AC? What would it cost?",2
106,4,1,"Certainly, I can sell you the AC for $24100.0 How does that sound?",4
106,5,0,I cannot afford to buy this product.,1
106,5,1,"I understand that you cannot afford to buy this product. However, I am willing to reduce the price to $18500.0 Are you interested?",4
106,6,0,"I'm interested. I don't have that much money, but the product is worth the investment and I don't want to lose it.",7
106,6,1,"The product is very good, and I am sure you will be satisfied with the purchase. If you are happy with the product, I will recommend you to give it to your friends.",7
123,1,0,"Hi, I want to purchase the tablet and the Docking station but I do not need the Headphones. Is it possible to remove those two from the deal? How much would it cost if I remove the Headphones?",2
123,1,1,"You can remove the Headphones from the deal, it would only cost you $74000.0",3
123,2,0,"Hello, I have already purchased the iPad Pro. Can we just sell me the docking station and the headphones? What would be the new price?",2
123,2,1,"Sure, I can sell you the docking station and headphones for $72300.0 it is a killer deal for the product.",4
123,3,0,"I've got a better deal, can you match it?",2
126,1,0,"What would be the price for the tablet, docking station, and headphones?",3
126,1,1,"With the tablet, docking station, and headphones it would cost you $40600.0 it is a killer deal for the product.",3
126,2,0,"I don't really need a Tablet, I just want the dock. Can you sell me only the dock for $27900.0",5
126,2,1,"Certainly! I can sell you just the dock for $27900, however, $27900.0 is too less. How about $38900.0",4
126,3,0,I need someone who can get me the tablet and the dock for $26900.0,4
126,3,1,"Sure, I can get you the tablet and the dock for $37900.0",4
126,4,0,I cannot accept your offer of $37900.0 I'm limited to a budget of $26900.0 Thank you for your interest.,7
161,1,0,"I'm sorry, but $26300.0 is way above my budget. Do you have something cheaper?",5
161,1,1,"Hello there! I'm sorry, but I'm not able to go down to $29500.0 If you are interested, please let me know.",7
161,2,0,I want to upgrade the TV to a higher-resolution display and a better soundbar for $29500.0 Can you sell me this TV and soundbar for $25300.0,3
161,2,1,I'm sorry I can't sell this TV and soundbar to you for $28500.0 I'm confident that we can come to an agreement to make this a profitable deal for you.,4
161,3,0,"Excuse me, I would like to buy the TV, soundbar and the TV stand but not the Vizio Soundbar. The price would be $23500.0 Is it possible?",2
161,3,1,"Certainly, the TV, soundbar and TV stand along with the Vizio soundbar and TV stand is only $26700.0 that is a killer deal.",3
161,4,0,I cannot go above $23500.0 I will not be able to afford this.,4
161,4,1,"I understand your budget constraints, but I'm sorry I cannot reduce the price of the TV. It is a great value for the price. It has a 120Hz refresh rate, which is ideal for watching fast-moving action and sports. It has a 120Hz refresh rate, which is ideal for watching fast-moving action and sports. It also has a 4K resolution, which is ideal for watching movies and other high-quality content. It has a 120Hz refresh rate, which is ideal for watching fast-moving action and sports. It also has a 4K resolution, which is ideal for watching movies and other high-quality content. It also has a 120Hz refresh rate, which is ideal for watching fast-moving",1
161,5,0,"Thank you for considering my offer. However, my budget is limited to $23500.0 and I cannot go higher than that. Good bye",7
163,1,0,"I really want the double ovens and the baking gloves, but I cannot afford the A Oven and the coffee mug. Can you sell me the double ovens and the baking gloves for $12400.0",2
163,1,1,"Oh, I see, you want the double ovens and the baking gloves for $12400.0 but I can only sell you the Oven and the mug. However, I can sell you the Oven and the mug for $17400.0 can I?",2
163,2,0,What is your best offer if I were to buy all the items at once?,2
163,2,1,With a discount of $13200.0 you can buy all of the items at once for $18200.0 how does that sound?,4
163,3,0,I do not want the delivery. Is it possible to just get the oven from you and pick it up at a later date?,7
163,3,1,"Of course, I would be happy to sell you the oven, but I am a bit concerned about the price, I am not sure if I can be sure that you will pay the price that I have quoted on the Internet. I am afraid that you will not pay for the oven and then I will be stuck with a big oven that I can't sell.",7
163,4,0,What type of cooking system does the KitchenAid KODE500ESS oven have?,7
163,4,1,The KitchenAid KODE500ESS oven has a true convection cooking system.,1
163,5,0,"$'NA' seems out of my budget, I can only go up to $12700.0",1
163,5,1,"I understand that $12700.0 is a little too high for you. However, I am willing to reduce the price to $15700.0 Is that acceptable?",4
163,6,0,I think I can afford $15700.0 but I cannot afford to pay more than $12700.0,5
163,6,1,"I'm sorry, but I will not be able to go that low. I'm willing to reduce the price to $14500.0 Are you interested?",4
163,7,0,you tell me more about the temperature probe?,7
163,7,1,The temperature probe is an indicator to show the temperature of the oven. The temperature probe is located at the front of the oven.,1
163,8,0,"Hi, I am interested in buying the oven, but I do not need the oven gloves. Is it possible to buy the oven without the oven gloves? What would be the new price?",2
163,8,1,"Absolutely possible. The oven and oven gloves, along with other accessories that I have available, would only cost you $12700.0 How does that sound?",2
