conversation_id,turn_no,speaker,utterance,strategy
1098,4,1,This is the most expensive product we sell. The docking station is an additional $30700.0 how does that sound?,4
1098,5,0,I cannot afford $30700.0 but I can go up to $25900.0 it is a small price to pay for a great product.,4
1098,5,1,"I understand your budget constraints, but I'm sorry I cannot reduce the price of the Microsoft Surface Pro 7. It has a 12.3-inch PixelSense display, 10th Gen Intel Core processors, up to 16GB RAM, up to 1TB storage, 8MP rear-facing camera, Windows Hello face authentication, and up to 10.5 hours of battery life. It also has a A Docking station called Lenovo ThinkPad USB-C Dock Gen 2. This docking station features USB-C and USB-A connectivity, HDMI, DisplayPort, and VGA ports, as well as audio and ethernet connections. It supports up to two displays and provides up to 90W of power delivery to compatible devices.",1
1098,6,0,"Excuse me, I want to buy the Microsoft Surface Pro 7 but I do not need the docking station. Is it possible to buy the Surface Pro 7 without the docking station? What is the new price for this?",2
1098,6,1,Certainly. I would be more than happy to sell you the product with out the docking station for $29000.0,4
1098,7,0,"the display of the Microsoft Surface Pro 7 A tablet 12.3-inch PixelSense display, 10th Gen Intel Core processors, up to 16GB RAM, up to 1TB storage, 8MP rear-facing camera, Windows Hello face authentication, and up to 10.5 hours of battery life. along with a A Docking station called Lenovo ThinkPad USB-C Dock Gen 2. This docking station features USB-C and USB-A connectivity, HDMI, DisplayPort, and VGA ports, as well as audio and ethernet connections. It supports up to two displays and provides up to 90W of power delivery to compatible devices., and A Memory cards called Samsung Evo Select microSDXC UHS-I Card.",7
1098,7,1,"The Microsoft Surface Pro 7 A tablet 12.3-inch PixelSense display, 10th Gen Intel Core processors, up to 16GB RAM, up to 1TB storage, 8MP rear-facing camera, Windows Hello face authentication, and up to 10.5 hours of battery life. along with a A Docking station called Lenovo ThinkPad USB-C Dock Gen 2. This docking station features USB-C and USB-A connectivity, HDMI, DisplayPort, and VGA ports, as well as audio and ethernet connections. It supports up to two displays and provides up to 90W of power delivery to compatible devices., and a A Memory cards called Samsung Evo Select microSDXC UHS-I Card.",1
1098,8,0,"I'm sorry, but I'm not interested in the Surface Pro 7. I would love to purchase the Microsoft Surface Pro 7. I would like to purchase the Surface Pro 7 for $25100.0",4
1098,8,1,"I understand your budget constraints, but I'm sorry I cannot reduce the price of the Microsoft Surface Pro 7. It has a 12.3-inch PixelSense display, 10th Gen Intel Core processors, up to 16GB RAM, up to 1TB storage, 8MP rear-facing camera, Windows Hello face authentication, and up to 10.5 hours of battery life. It supports up to two displays and provides up to 90W of power delivery to compatible devices.",1
1098,9,0,Is the Microsoft Surface Pro 7 come with a battery life of up to 10.5 hours?,7
1098,9,1,"The Microsoft Surface Pro 7 will give you up to 10.5 hours of battery life. It has a 12.3-inch PixelSense display, 10th Gen Intel Core processors, up to 16GB RAM, up to 1TB storage, 8MP rear-facing camera, Windows Hello face authentication, and up to 10.5 hours of battery life. Along with a Docking station called Lenovo ThinkPad USB-C Dock Gen 2. This docking station features USB-C and USB-A connectivity, HDMI, DisplayPort, and VGA ports, as well as audio and ethernet connections. It supports up to two displays and provides up to 90W of power delivery to compatible devices. You can also use a A Memory",1
1098,10,0,"What would be the price for the tablet, docking station, the memory card, and other accessories all together?",3
1098,10,1,$29000.0 for the package. How does that sound?,4
1098,11,0,What is the price of the bundle if I want to buy the Surface Pro 7 and the docking station?,3
1098,11,1,The total cost would be $30600.0 how does that sound?,2
1098,12,0,I really want the tablet but I am not willing to pay the price that it has. Is there a way for me to get the tablet at a lower price?,5
1098,12,1,I'm sorry but I really don't think that you can get the tablet for $30000. It was my suggestion that you can get the tablet for $26100.0 but I guess that you can get it even lower. How about $30000.0,4
1098,13,0,What is my best deal if I were to buy the computer along with the memory cards?,2
1098,13,1,"In this case, it would be $30500.0 how does that sound?",4
1098,14,0,"I appreciate the offer, but I cannot afford a product that costs $26600.0",5
1098,14,1,"I understand your budget constraints, but I'm sorry I cannot reduce the price of the Microsoft Surface Pro 7. It has a 12.3-inch PixelSense display, 10th Gen Intel Core processors, up to 16GB RAM, up to 1TB storage, 8MP rear-facing camera, Windows Hello face authentication, and up to 10.5 hours of battery life. It also has a A Docking station called Lenovo ThinkPad USB-C Dock Gen 2. This docking station features USB-C and USB-A connectivity, HDMI, DisplayPort, and VGA ports, as well as audio and ethernet connections. It supports up to two displays and provides up to 90W of power delivery to compatible devices.",1
1098,15,0,you let me know the capacity of the memory card? The customer is in a conversation with a seller about a men's watch. The seller is selling it for $'NA' The customer wants to clarify about the band of the watch. The customer asks What is the material of the band?,7
1098,15,1,The material of the band is leather. Is there any other question that I can help you with?,5
1098,16,0,Would you let me know what is the docking station?,7
1098,16,1,"The docking station is Lenovo ThinkPad USB-C Dock Gen 2. This docking station features USB-C and USB-A connectivity, HDMI, DisplayPort, and VGA ports, as well as audio and ethernet connections. It supports up to two displays and provides up to 90W of power delivery to compatible devices.",1
1098,17,0,"Thank you for your price information, I'm looking to purchase this tablet. I'm wondering if this is the right model for me.",7
1098,17,1,"I understand your budget constraints, but I'm sorry I cannot reduce the price of the Microsoft Surface Pro 7. It has a 12.3-inch PixelSense display, 10th Gen Intel Core processors, up to 16GB RAM, up to 1TB storage, 8MP rear-facing camera, Windows Hello face authentication, and up to 10.5 hours of battery life. It also has a A Docking station called Lenovo ThinkPad USB-C Dock Gen 2. This docking station features USB-C and USB-A connectivity, HDMI, DisplayPort, and VGA ports, as well as audio and ethernet connections. It supports up to two displays and provides up to 90W of power delivery to compatible devices.",1
1098,18,0,I cannot accept your offer of $30500.0 since I'm limited to my budget of $27900.0 Let me know if you wish to purchase it at this price. Thank you.,7
1098,18,1,"Ok, we understand your budget limitations. Thank you for your interest and we'll let you know if we wish to purchase it at this price.",7
1098,19,0,Thank you for your interest in the Surface Pro 7 Tablet. This is a great product and I will purchase it for $27900.0,7
1098,19,1,"Thank you for your interest in the product, but we cannot sell it for $27900.0 The manufacturer is offering a special promotion for $27900.0",7
1111,1,0,"What would be the price for the camera, tripod, and flash altogether?",7
1111,1,1,"The camera, tripod, and flash altogether would cost you $34400.0 it is a killer deal for the product.",7
1111,2,0,"I'm sorry, but I can't afford that. Is there any way you can offer a discount?",5
1111,2,1,"I'm sorry, but I will not be able to go as low as $28600.0 However, I'm willing to meet you in the middle at $31600.0 Are you interested?",4
1111,3,0,"I do not want the delivery, and I only need the camera, can you please offer me a new deal?",7
1111,3,1,"Sure, I can offer you a special deal, for a camera only, with no delivery, for $31100.0 how does that sound?",4
1111,4,0,"What would be the total price of the products, with shipping?",3
1111,4,1,"The total amount would be $31100.0 with shipping, how does that sound?",4
1111,5,0,I really like the camera and the tripod. I am on a tight budget and I cannot afford both. Can you sell me the camera for $27200.0,5
1111,5,1,"Very well, I can sell you the camera for $30200.0 however, it'll be a great deal!",4
1111,6,0,"Hello, I am interested in buying the A Canon EOS 5D Mark IV Camera. I don't need the A Fujifilm EF-60 Shoe Mount Flash, can we remove it from the deal?",2
1111,6,1,The camera with the flash is $28300.0 how does that sound?,7
1111,7,0,you have any information on the material of the camera? Is it made of aluminum or magnesium?,7
1111,7,1,The camera is made of magnesium alloy.,1
1111,8,0,"Sorry, $'NA' is not within my budget. Is there any way you can sell it to me for $25300.0",5
1111,8,1,"I understand your budget constraints, but I'm sorry I cannot reduce the price of the Canon EOS 5D Mark IV. It is a very high-quality camera, and I am sure that it will exceed your expectations even for $28300.0",1
1111,9,0,"Thank you for considering my offer. However, I cannot reduce the price of $25300.0 because this is my limit.",7
1118,1,0,"What would be the total price for the oven, gloves, and cleaner altogether?",3
1118,1,1,"The oven, gloves, and cleaner altogether would be $15600.0 it is a killer deal for the product.",3
1118,2,0,"Hello, I do not need the delivery. I will pick up the microwave myself and pay for self-delivery.",7
1118,2,1,You could buy the microwave yourself for $15100.0 it is an awesome deal.,2
1118,3,0,"I do not need the Oven Mitts, is it possible to remove them from the deal? What would be the new price?",2
1118,3,1,"Sure, I can remove them from the deal and sell it for $13300.0 How does that sound?",4
1118,4,0,"Hey, I do not need the microwave cleaner, is it possible to remove it from the deal?",2
1118,4,1,"Sure, I can remove it from the deal, but I would have to charge you $12300.0 for the package if you remove the microwave cleaner.",2
1118,5,0,"I cannot afford to buy this product, even at $7200.0",4
1118,5,1,"I understand your budget constraints, but I'm sorry I cannot lower the price of the LG LDE4415ST. It has a total capacity of 7.3 cu. ft. and features a true convection cooking system with a fan and a third heating element. It also has an infrared broiler, a smooth cooktop surface, and a self-cleaning system. It does not have a temperature probe. This electric double oven is one of the most popular models in the LG line of products, and I'm sure that it will be worth the investment even for $12300.0 I'm sure that you will be pleased with it even if you cannot afford to buy it.",1
1118,6,0,cooking system of this oven is a _____?,7
1118,6,1,This electric double oven has a true convection cooking system with a fan and a third heating element.,1
1118,7,0,t is Microwave oven cleaner?,7
1118,7,1,"This is an electric double oven. It can be used to bake, broil, roast, and fry. It has a total capacity of 7.3 cu. ft. The brand is LG. This is a microwave oven cleaner. It can be used to clean your microwave.",1
1118,8,0,What is your best deal if I were to buy the entire package?,2
1118,8,1,"The entire package would cost you $14000.0 it is not a bargain, this is a killer deal.",2
1118,9,0,"I'm sorry, but the entire package would cost you $10500.0 it is not a bargain, this is a killer deal.",4
1118,9,1,"I'm sorry but the entire package would cost you $12400.0 it is not a bargain, this is a killer deal.",4
1118,10,0,I see. I'll take it.,7
1118,10,1,Thank you for your interest in my product. I am glad to see that you find the price reasonable and that the product is of the quality you expect. I am happy to conclude the transaction with you.,7
1134,1,0,"Hey, I am interested in buying the refrigerator but I do not need the covers. Can I remove the covers from the deal? What would the price be?",2
1134,1,1,"Sure, if you don't need the covers, I can remove them for you and sell you the whole product for $20900.0 How does that sound?",2
1134,2,0,"I really like the refrigerator but I do not have enough money to buy it. Can I have the stand, covers and pull-out drawer for $14800.0",5
1134,2,1,"Yes, I can sell you the fridge, can I also add the stand, covers, and pull-out drawer for $20200.0",2
1134,3,0,"$14800.0 is too much, I cannot afford it.",5
1134,3,1,"$14800.0 is a great price for this refrigerator! It has a large capacity, is easy to clean, and has many useful features such as an adjustable ice maker, a built-in water dispenser, a large freezer, and a large refrigerator. It is also a great value for the price. I'm sure that you will be pleased with it even for $20200.0",1
1134,4,0,Your offer of $14800.0 is great! That's a great price for this refrigerator. I'm sure it will meet your needs perfectly.,7
1137,1,0,"I'm sorry, the laptop you are offering is too expensive. I'm willing to buy it for $65200.0",4
1137,1,1,"Hello! I'm really sorry, the laptop that you are offering is too expensive. I'm not even sure if I can sell it for $79800.0 I hope you'll be able to find something closer to your budget.",4
1137,2,0,"I really like the ThinkPad X1 Carbon. However, I cannot afford its high price tag. Can you sell me the laptop for $64100.0",5
1137,2,1,"Yes, I can sell you the laptop for $64100, however you'll have to pay $78700 for it. The laptop is worth $64100 however, $64100.0 is too more. How about $78700.0",4
1137,3,0,What will be the price of the bundle? I am considering buying both the laptop and mouse?,3
1137,3,1,The laptop and mouse would only be $79700.0 together.,7
1137,4,0,"Hello, I am interested in buying your laptop but I do not need the delivery. Is it possible to buy the laptop without the delivery? How much would the price be?",2
1137,4,1,"Yes, I can sell you the laptop without the delivery for $79200.0 How does that sound?",4
1137,5,0,Is the display of the A Laptop called Lenovo ThinkPad X1 Carbon 14-inch good? Can you tell me more about the display of the A Laptop called Lenovo ThinkPad X1 Carbon?,7
1137,5,1,"The display of the Lenovo ThinkPad X1 Carbon is good. It has a 14-inch display, up to 10th-generation Intel Core processors, and up to 16GB of memory.",1
1137,6,0,"$64600.0 is the maximum that I can afford, I cannot go more than that.",5
1137,6,1,"While I appreciate your offer, I cannot go as low as $64600.0 I cannot reduce the price of the laptop since it is a business laptop and has advanced security features. It also has a durable design, long battery life, and advanced security features, making it worth the investment even for $79200.0",4
1137,7,0,I appreciate the offer of $79200.0 but I cannot afford more than $64600.0,4
1137,7,1,"I understand that $64600.0 is above your budget, but I'm willing to meet you in the middle at $69900.0 Are you interested?",2
1137,8,0,I do not really need the laptop for business. I will use the laptop to play games on it from time to time. I cannot afford the Razer DeathAdder Elite. Can you sell me the Lenovo Thinkpad X1 Carbon for $63200.0,5
1137,8,1,"Sure! I can remove the Razer DeathAdder Elite from the bundle and sell you the Lenovo Thinkpad X1 Carbon, however I'm sorry but I cannot match the offer you made for $68500.0",4
1137,9,0,I understand your price of $63200.0 and I would like to purchase the Lenovo Thinkpad X1 Carbon. Let's proceed with the transaction.,7
1137,9,1,"I have found an interesting article by Tim Lee, a former Google engineer. It's a great read, and I'm sure you will like it too!",7
1143,1,0,Can I buy just the A Oven?,2
1143,1,1,If you want just the A Oven you can buy just the A Oven for $28800.0 How does that sound?,2
1143,2,0,"I cannot afford to buy this product, sorry.",1
1143,2,1,"I understand your budget constraints, but I'm sorry I cannot reduce the price of the A Oven. It has a true European convection cooking system, ten-pass bake element, and an eight-pass broil element. It also has a touch display that shows temperature, cooking time, and oven status. It does not have a self cleaning system. It does not have a temperature probe.",1
1143,3,0,"Are these items needed to complete the deal? If not, can we modify the deal to remove delivery and include other items instead?",2
1143,3,1,"Well, if you want the deal, I would include the items.",7
1143,4,0,The total price of the product along with the add-on is $21800.0 What will be the price of the product without the add-on?,3
1143,4,1,The total price of the product without the add-on would be $30100.0 can I have the check please?,2
1143,5,0,an you help me to clarify Temperature probe?,7
1143,5,1,This oven has a temperature probe.,1
1143,6,0,"What would be the price for the oven, microwave, and coffee mug together?",2
1143,6,1,"The oven, microwave, and coffee mug would only cost you $30100.0 it is a killer deal for the product.",3
1143,7,0,Is the oven of the A Oven called GE Profile PTD9000SNSS double wall oven with a total capacity of 10 cu. ft. a European convection cooking system?,7
1143,7,1,The oven is European convection cooking system.,1
1143,8,0,"What would be the total price of the oven, microwave, and baking dishes?",3
1143,8,1,"The oven, microwave, and baking dishes would only cost you $30100.0 it is a killer deal for the product.",3
1143,9,0,I cannot go more than $21800.0 I am sorry.,5
1143,9,1,I understand your budget of $21800.0 and am willing to meet you in the middle at $26400.0 Are you interested?,2
1143,10,0,"I'm interested. You made a good point about the oven's features, and I agree that $24100.0 is a fair price. I'm willing to purchase it at that price. Let's proceed with the transaction.",7
1143,10,1,"You made a good point about the oven's features, and I agree that $24100.0 is a fair price. I'm sure that you will be happy with your purchase. We can now proceed with the transaction!",7
1150,1,0,I really want this camera but I am on a budget. Can you sell me the camera for $28300.0,5
1150,1,1,"How about $41200.0 I like the price, but I'm sorry, I can't match your offer.",4
1150,2,0,What is the autofocus point of the Canon EOS R6 camera?,7
1150,2,1,The camera has a total of 5940 autofocus points. They are located on the left and right sides of the camera.,1
1150,3,0,"Excuse me, I do not need the delivery. Is it possible to remove the delivery from the deal? And what would be the new price?",2
1150,3,1,"Certainly, it is possible to remove the delivery from the deal. The new price would be $40700.0 How does that sound?",2
1150,4,0,I can only go up to $27800.0,5
1150,4,1,I understand that you have a budget of $27800.0 and that is above my price range. I'm willing to negotiate down to $35600.0 Is this acceptable?,4
1150,5,0,I cannot accept your offer of $35600.0 since I have a budget of $27800.0 Thank you for your interest.,7
1154,1,0,"What would be the price for the whole bundle, including the flash and remote?",3
1154,1,1,"The bundle would be $50300, but $50300 minus $32400.0 is $50300.0 how does that sound?",2
1154,2,0,"I don't need the flash, can you just sell me the camera?",7
1154,2,1,"That's a lot of money, but I can make a killing on this deal. I could probably sell it for $48400.0 but it is your camera that I would be selling, not the camera with the flash.",4
1154,3,0,the video recording capabilities does this camera have?,7
1154,3,1,"Yes, this camera can record videos in 4K resolution.",1
1154,4,0,What is your offer if I also buy the flash?,2
1154,4,1,I would be happy to sell you the bundle for $50200.0 how does that sound?,4
1154,5,0,I am not really looking for the NA and the flash. I am really only looking for the camera. Can you sell me the camera for $30400.0,5
1154,5,1,Oh! I see! You want the camera for $48300.0 I will sell you the camera but you must pay the rest with cash. I'm sorry I don't have any credit card! Can you pay by cash?,4
1154,6,0,Would you let me know the sensor resolution of this camera? I'm interested in purchasing it.,7
1154,6,1,"The sensor resolution of the Canon EOS R6 is APS-C, which is 18.1 megapixels.",1
1154,7,0,"What would be the total price for the camera, flash and remote shutter release?",7
1154,7,1,"$48300.0 that is a very good deal, I don't think I can beat that price.",5
1154,8,0,What will be the price if I buy the camera along with the flash and the remote release?,3
1154,8,1,"The bundle including flash, remote, and camera would cost you $50100.0 it is a killer deal for the product.",3
1154,9,0,"you please let me know about the External flash, i.e. what is its range, what is the zoom power, what are the guide number values, etc?",7
1154,9,1,The External flash has a wide zoom range of 24-120mm with a guide number of 92' at ISO 100 and 35mm and it has a tilt range of -7锟斤拷锟斤拷锟斤拷锟斤拷锟斤拷锟斤拷锟斤拷锟斤拷锟斤拷 to 90锟斤拷锟斤拷锟斤拷锟斤拷锟斤拷锟斤拷锟斤拷锟斤拷锟斤拷 and a rotation range of 180锟斤拷锟斤拷锟斤拷锟斤拷锟斤拷锟斤拷锟斤拷锟斤拷锟斤拷 in both directions.,1
1154,10,0,"I'm sorry, I cannot afford more than $35500.0 I am not willing to go higher than that. Good bye",4
1156,1,0,and I get this SmartPhone with a screen of 5.9-inch size?,7
1156,1,1,"Yes, you can get the Xiaomi Mi 11 Ultra with a screen of 5.9-inch size. This Smartphone is also available in black, silver and gold.",1
1156,2,0,"Hello, I am interested in buying the Xiaomi Mi 11 Ultra but I do not need the phone charger. Is it possible to buy the phone without the phone charger? What would be the new price?",2
1156,2,1,"Certainly, I can sell you the product without the charger for $70600.0 how does that sound?",4
1156,3,0,I can only afford $47900.0 I cannot go any more.,5
1156,3,1,"I understand that you cannot afford the price. However, I'm willing to reduce the price to $62000.0 Are you interested?",4
1156,4,0,What will be the total price if I buy the Xiaomi Mi 11 Ultra along with the Manfrotto PIXI Mini Tripod and the Samsung 25W USB-C Super Fast Charging Wall Charger?,3
1156,4,1,The total price would be $63300.0 how does that sound?,4
1156,5,0,"I'm sorry, the price is still way too expensive. I'm willing to spend $51800.0 but I can't go any higher.",4
1156,5,1,I understand your budget is $51800.0 I'm willing to sell this phone for $57800.0 Are you interested?,4
1156,6,0,"Yes, I'm interested.",7
1156,6,1,"Thank you for your order, we will be getting it out to you in a few days.",7
1165,1,0,"I'm sorry, but I can't afford that amount. Can you meet me somewhere in the middle and sell it to me for $35000.0",2
1165,1,1,"Hello there! I'm sorry, but I can't meet you halfway. I'm willing to lower the price to $39700 but that is the lowest amount I can go. I'm sure you can understand that I need to make a profit on this item, so $35000.0 is not an option. Let me know if you'd like to purchase it for $39700.0",4
1165,2,0,I really want this fridge but I cannot afford the price. Is it possible to sell the fridge to me for $33700.0,5
1165,2,1,"Sure, I'm more than happy to sell you the fridge because it is a great purchase, however, $33700.0 is too less. How about $38400.0",4
1165,3,0,"Hello, I am interested in buying the refrigerator without the stand and the drawer, but I need the extension cord. How much would it cost?",2
1165,3,1,"Hello, the refrigerator with the stand, the drawer and the extension cord would only cost you $37700.0 It is a killer deal for the product.",3
1165,4,0,"Is it right to call this extension cord ""Extension cords""?",7
1165,4,1,"The extension cord is called ""Extension cords"". Can I help you with anything else?",1
1165,5,0,"Thank you for your offer, but my budget is limited to $'NA' I can only accept an offer of $33000.0 or less. Please let me know if you have anything else. Thank you.",7
1169,1,0,"What would be the total cost of the printer, the ink cartridges, and the wireless adapters along with the accessories?",7
1169,1,1,"The printer, ink cartridges and wireless adapters would only cost you $45400.0 the accessories are optional.",7
1169,2,0,"I am interested to buy the A Printer, but I do not need the ink or toner cartridges. What is the new price?",7
1169,2,1,"The A Printer, with ink and toner included, would only cost you $44400.0",7
1169,3,0,"I'm sorry, $35200.0 is still above my budget. Can you offer me a discount?",4
1169,3,1,"I'm sorry but I will not be able to go that low. However, I'm willing to reduce the price to $40000.0 Are you interested?",4
1169,4,0,"$36900.0 is not a good price for this printer, I will never be able to afford it.",7
1169,4,1,"I'm very sorry to hear that, but we still have a good deal for you. The customer says, ""I'm still willing to purchase it at $36900.0 The seller replies by saying. I'm happy to inform you that I can get you this printer for $36900.0 with a huge discount!",7
1172,1,0,"What would be the price for this AC, thermostats, and extension cord?",3
1172,1,1,"The AC, thermostat, and extension cord would only cost you $61900.0 it is a killer deal for the product.",3
1172,2,0,I can only afford $61900.0 but I will be able to pay $44800.0,5
1172,2,1,"I understand that you can only afford $44800.0 for this product, but I'm willing to reduce the price to $55200.0 Are you interested?",4
1172,3,0,I really want this AC but can you sell me the AC for $43700.0,5
1172,3,1,"Sure! I can reduce the price by $1000, but $43700.0 is way too much, how about $54100.0",4
1172,4,0,"Hello, I do not want the extension cords to be included in the deal, can we remove them?",2
